{
  "format": "ovs-tag-registry",
  "version": "0.1",
  "updated": "2026-07-07",
  "minItems": 10,
  "tags": [
    { "id": "ovs:tag/organic", "label": "Organic", "aliases": ["organic-certified"], "kind": "property", "reads": "The item or source data carries an organic claim or label; check the specific jurisdiction when it matters.", "receipt": null },
    { "id": "ovs:tag/vegetarian", "label": "Vegetarian", "aliases": [], "kind": "property", "reads": "The item is marked or described as vegetarian, usually meaning no meat or fish ingredients.", "receipt": null },
    { "id": "ovs:tag/vegan", "label": "Vegan", "aliases": ["plant-based vegan"], "kind": "property", "reads": "The item is marked or described as avoiding animal-derived ingredients or use.", "receipt": null },
    { "id": "ovs:tag/transparent", "label": "Transparent", "aliases": ["transparency"], "kind": "property", "reads": "The source provides clearer ingredients, sourcing, governance, pricing, code, or policy information than the category norm.", "receipt": null },
    { "id": "ovs:tag/palm-oil-free", "label": "Palm-oil-free", "aliases": ["palm oil free"], "kind": "property", "reads": "The item is marked as avoiding palm oil or palm-derived ingredients in the current source data.", "receipt": null },
    { "id": "ovs:tag/free", "label": "Free", "aliases": ["no-cost"], "kind": "property", "reads": "The option is free to use or access in its main public form.", "receipt": null },
    { "id": "ovs:tag/no-added-sugar", "label": "No added sugar", "aliases": ["no-added-sugar"], "kind": "property", "reads": "The item is marked as having no added sugar in the source data.", "receipt": null },
    { "id": "ovs:tag/fair-trade", "label": "Fair Trade", "aliases": ["fairtrade", "fair-trade"], "kind": "certification", "reads": "Fair Trade marks goods checked by certifiers against farmer and worker standards.", "receipt": "https://www.fairtrade.net/act/fairtrade-certification" },
    { "id": "ovs:tag/mainstream", "label": "Mainstream", "aliases": ["widely available"], "kind": "topic", "reads": "The option is easy to find through ordinary retail, app stores, banks, schools, or public institutions.", "receipt": null },
    { "id": "ovs:tag/open-source", "label": "Open source", "aliases": ["open-source", "opensource", "source-available", "source available", "foss", "free software"], "kind": "property", "reads": "The code can be inspected or reused to some degree; source-available is weaker than OSI open source, so licenses still matter.", "receipt": "https://opensource.org/osd" },
    { "id": "ovs:tag/rainforest-alliance", "label": "Rainforest Alliance", "aliases": ["rainforest-alliance"], "kind": "certification", "reads": "Rainforest Alliance certifies farms and supply chains against its farm, forest, climate, and livelihood standard.", "receipt": "https://www.rainforest-alliance.org/business/certification/" },
    { "id": "ovs:tag/closed-source", "label": "Closed source", "aliases": ["proprietary"], "kind": "property", "reads": "The code or system is not publicly inspectable in a way that lets users independently audit it.", "receipt": null },
    { "id": "ovs:tag/freemium", "label": "Freemium", "aliases": [], "kind": "property", "reads": "The option offers a free tier while reserving meaningful capacity, features, or convenience for paid plans.", "receipt": null },
    { "id": "ovs:tag/affordable", "label": "Affordable", "aliases": ["budget-friendly"], "kind": "property", "reads": "The option is comparatively low-cost or economical for the category.", "receipt": null },
    { "id": "ovs:tag/cruelty-free", "label": "Cruelty-free", "aliases": ["not tested on animals"], "kind": "property", "reads": "The item is marked as avoiding animal testing, though the exact standard can vary by source.", "receipt": null },
    { "id": "ovs:tag/reusable", "label": "Reusable", "aliases": ["re-useable"], "kind": "property", "reads": "The option is designed to be used repeatedly rather than discarded after one use.", "receipt": null },
    { "id": "ovs:tag/b-corp", "label": "B Corp", "aliases": ["b corporation", "bcorp", "certified b corporation"], "kind": "certification", "reads": "B Lab certifies B Corps against social, environmental, governance, and transparency standards.", "receipt": "https://www.bcorporation.net/en-us/standards/" },
    { "id": "ovs:tag/self-hostable", "label": "Self-hostable", "aliases": ["self hosted", "self-hosted"], "kind": "property", "reads": "A person or organization can run the service on infrastructure they control.", "receipt": null },
    { "id": "ovs:tag/nonprofit", "label": "Nonprofit", "aliases": ["not-for-profit"], "kind": "property", "reads": "The organization is structured as a nonprofit or public-interest institution rather than a conventional profit-maximizing company.", "receipt": null },
    { "id": "ovs:tag/public-resource", "label": "Public resource", "aliases": ["public-service resource"], "kind": "topic", "reads": "The resource is maintained for broad public benefit, often by a government, nonprofit, school, library, or civic body.", "receipt": null },
    { "id": "ovs:tag/technical", "label": "Technical", "aliases": ["advanced users"], "kind": "topic", "reads": "The option rewards technical confidence or specialized knowledge more than a typical mainstream choice.", "receipt": null },
    { "id": "ovs:tag/digital-literacy", "label": "Digital literacy", "aliases": ["digital skills"], "kind": "topic", "reads": "The resource helps people understand, use, question, or protect themselves in digital systems.", "receipt": null },
    { "id": "ovs:tag/media-literacy", "label": "Media literacy", "aliases": ["information literacy"], "kind": "topic", "reads": "The resource helps people judge sources, claims, images, platforms, and information environments.", "receipt": null },
    { "id": "ovs:tag/plastic-free", "label": "Plastic-free", "aliases": ["plastic free"], "kind": "property", "reads": "The item is designed to avoid plastic in the product, packaging, or recurring consumables.", "receipt": null },
    { "id": "ovs:tag/privacy", "label": "Privacy", "aliases": ["private", "privacy-first"], "kind": "topic", "reads": "The option limits data collection, exposure, tracking, or third-party dependence compared with category norms.", "receipt": null },
    { "id": "ovs:tag/repairable", "label": "Repairable", "aliases": ["repair-friendly"], "kind": "property", "reads": "The option can be fixed, maintained, or extended instead of being replaced quickly.", "receipt": null },
    { "id": "ovs:tag/research", "label": "Research", "aliases": ["research-backed"], "kind": "topic", "reads": "The resource is useful for inquiry, evidence gathering, scholarship, or serious background work.", "receipt": null },
    { "id": "ovs:tag/school-support", "label": "School support", "aliases": ["classroom support"], "kind": "topic", "reads": "The resource is especially useful for students, teachers, schools, or structured learning contexts.", "receipt": null },
    { "id": "ovs:tag/policy", "label": "Policy", "aliases": ["public policy"], "kind": "topic", "reads": "The resource helps with laws, regulation, civic institutions, governance, or policy analysis.", "receipt": null },
    { "id": "ovs:tag/durable", "label": "Durable", "aliases": ["long-lasting"], "kind": "property", "reads": "The option is built or maintained for longer useful life than disposable or fast-cycle alternatives.", "receipt": null },
    { "id": "ovs:tag/career-skills", "label": "Career skills", "aliases": ["job skills"], "kind": "topic", "reads": "The resource helps people build skills that can support work, credentials, or career mobility.", "receipt": null },
    { "id": "ovs:tag/subscription", "label": "Subscription", "aliases": ["recurring payment"], "kind": "property", "reads": "The option depends on a recurring payment or membership model.", "receipt": null },
    { "id": "ovs:tag/open-access", "label": "Open access", "aliases": ["open-access"], "kind": "property", "reads": "The material is freely available to read, use, or learn from without ordinary paywall barriers.", "receipt": null },
    { "id": "ovs:tag/open-data", "label": "Open data", "aliases": ["open-data"], "kind": "property", "reads": "The resource publishes reusable data with public access and some permission to inspect or reuse it.", "receipt": null },
    { "id": "ovs:tag/interactive", "label": "Interactive", "aliases": ["hands-on"], "kind": "topic", "reads": "The option includes exercises, tools, practice, simulations, or other active learning surfaces.", "receipt": null },
    { "id": "ovs:tag/coding", "label": "Coding", "aliases": ["programming"], "kind": "topic", "reads": "The resource teaches or supports programming, software development, scripting, or code literacy.", "receipt": null },
    { "id": "ovs:tag/free-tier", "label": "Free tier", "aliases": ["free plan"], "kind": "property", "reads": "The service has a usable free plan, even if some features require payment.", "receipt": null },
    { "id": "ovs:tag/accessible", "label": "Accessible", "aliases": ["accessibility"], "kind": "property", "reads": "The option pays attention to disability access, low-barrier use, readable design, or assistive-technology support.", "receipt": null },
    { "id": "ovs:tag/ai-literacy", "label": "AI literacy", "aliases": ["artificial intelligence literacy"], "kind": "topic", "reads": "The resource helps people understand, evaluate, or safely use AI systems.", "receipt": null },
    { "id": "ovs:tag/certified", "label": "Certified", "aliases": ["third-party certified"], "kind": "property", "reads": "The item carries some form of certification or program listing, but the specific standard still matters.", "receipt": null },